{
  "id": "radroachraces",
  "name": "Radroach Races",
  "author": "@Theeohn @CodyTolene",
  "version": "2.1.1",
  "description": "A version of the internet famous Horse Race Tests game now for your Pip-boy. Start the game up, choose a map, 5 seconds to place your bets and they're off! Using logic similar to the DVD bouncing logo to race to the mutfruit at the end, who will win? 5 Roaches, 16 seperate tracks. Endless hours of fun watching, betting, and forming your own headcanons!",
  "icon": "storage/RACES.IMG",
  "previews": ["previews/MENU.BMP", "previews/GAME.BMP", "previews/START.BMP"],
  "type": "game",
  "readme": "README.md",
  "storage": [
    {
      "pipboy": "HOLO/RADROACH_RACES/APP.JS",
      "source": "storage/APP.TS"
    },
    {
      "pipboy": "HOLO/RADROACH_RACES/BUGLE.WAV",
      "source": "storage/BUGLE.WAV"
    },
    {
      "pipboy": "HOLO/RADROACH_RACES/CIRCLEW.BIN",
      "source": "storage/CIRCLEW.BIN"
    },
    {
      "pipboy": "HOLO/RADROACH_RACES/DELTAW.BIN",
      "source": "storage/DELTAW.BIN"
    },
    {
      "pipboy": "HOLO/RADROACH_RACES/DIAMONDW.BIN",
      "source": "storage/DIAMONDW.BIN"
    },
    {
      "pipboy": "HOLO/RADROACH_RACES/FLAP.WAV",
      "source": "storage/FLAP.WAV"
    },
    {
      "pipboy": "HOLO/RADROACH_RACES/MAPS.JS",
      "source": "storage/MAPS.TS"
    },
    {
      "pipboy": "HOLO/RADROACH_RACES/RACE.JS",
      "source": "storage/RACE.TS"
    },
    {
      "pipboy": "HOLO/RADROACH_RACES/ROACH.JSON",
      "source": "storage/ROACH.JSON"
    },
    {
      "pipboy": "HOLO/RADROACH_RACES/SQUAREW.BIN",
      "source": "storage/SQUAREW.BIN"
    },
    {
      "pipboy": "HOLO/RADROACH_RACES/TITLE.JS",
      "source": "storage/TITLE.TS"
    },
    {
      "pipboy": "HOLO/RADROACH_RACES/TITLEIMG.BIN",
      "source": "storage/TITLEIMG.BIN"
    },
    {
      "pipboy": "HOLO/RADROACH_RACES/TRIANGLEW.BIN",
      "source": "storage/TRIANGLEW.BIN"
    },
    {
      "pipboy": "HOLO/RADROACH_RACES/WINNER.WAV",
      "source": "storage/WINNER.WAV"
    }
  ],
  "storageOptional": []
}
