{
  "id": "pipman",
  "name": "PIPMAN",
  "author": "@McBeefy34",
  "version": "1.0.1",
  "description": "PipMan is a Pac-Man inspired arcade game built for the Pip-Boy 3000, blending retro gaming nostalgia with the iconic wasteland aesthetic. Navigate the vault, dodge ghouls, and collect every bottle caps, all from the wrist-mounted terminal of the Commonwealth.",
  "icon": "storage/PIPMAN_LOGO.PNG",
  "previews": ["previews/MENU.BMP", "previews/GAME.BMP"],
  "type": "game",
  "readme": "README.md",
  "storage": [
    {
      "pipboy": "HOLO/PIPMAN/APP.JS",
      "source": "storage/APP.TS"
    }
  ],
  "storageOptional": []
}
