{
  "id": "pip-co-idle-frameworks",
  "name": "PIP-CO Idle Frameworks",
  "author": "@LlamaYeYe",
  "version": "1.2.0",
  "description": "Adds a 2-minute Pip-Boy idle screensaver you can point at the built-in PIP-BOY 3000 animation, or hand off to an installed Mesmetron item or Pipquarium, with a live preview for whichever is selected.",
  "icon": "storage/PIPCOIDLEFRAMEWORKS.IMG",
  "previews": ["previews/MENU.BMP"],
  "type": "app",
  "readme": "README.md",
  "storage": [
    {
      "pipboy": "HOLO/FALLOUT_SCREENSAVER/APP.JS",
      "source": "storage/APP.TS"
    },
    {
      "pipboy": "HOLO/FALLOUT_SCREENSAVER/BOMB.BIN",
      "source": "storage/BOMB.BIN"
    },
    {
      "pipboy": "HOLO/FALLOUT_SCREENSAVER/BOMBRUN.JS",
      "source": "storage/BOMBRUN.TS"
    },
    {
      "pipboy": "HOLO/FALLOUT_SCREENSAVER/CONFIG.JSON",
      "source": "storage/CONFIG.JSON"
    },
    {
      "pipboy": "HOLO/FALLOUT_SCREENSAVER/FALLOUT.WAV",
      "source": "storage/FALLOUT.WAV"
    },
    {
      "pipboy": "HOLO/FALLOUT_SCREENSAVER/IDLE.JS",
      "source": "storage/IDLE.TS"
    },
    {
      "pipboy": "HOLO/FALLOUT_SCREENSAVER/LOGO.BIN",
      "source": "storage/LOGO.BIN"
    },
    {
      "pipboy": "HOLO/FALLOUT_SCREENSAVER/MESIDLE.JS",
      "source": "storage/MESIDLE.TS"
    },
    {
      "pipboy": "HOLO/FALLOUT_SCREENSAVER/PIPCOIDLEFRAMEWORKS.IMG",
      "source": "storage/PIPCOIDLEFRAMEWORKS.IMG"
    },
    {
      "pipboy": "HOLO/FALLOUT_SCREENSAVER/PIPQMODE.CFG",
      "source": "storage/PIPQMODE.CFG"
    },
    {
      "pipboy": "HOLO/FALLOUT_SCREENSAVER/PIPQRUN.JS",
      "source": "storage/PIPQRUN.TS"
    },
    {
      "pipboy": "HOLO/FALLOUT_SCREENSAVER/SERVICE.JS",
      "source": "storage/SERVICE.TS"
    },
    {
      "pipboy": "HOLO/FALLOUT_SCREENSAVER/TITLE.BIN",
      "source": "storage/TITLE.BIN"
    },
    {
      "pipboy": "HOLO/FALLOUT_SCREENSAVER/WAKE.JS",
      "source": "storage/WAKE.TS"
    }
  ],
  "storageOptional": []
}
