{
  "id": "radrunner",
  "name": "RAD RUNNER",
  "author": "@SukeMobile",
  "version": "1.0.0",
  "description": "RAD RUNNER is an endless three-lane wasteland runner for the Pip-Boy 3000. Bomb down a cracked desert highway: switch lanes to dodge wrecked cars, jump the radroaches, duck the busted signs, and shoot the ghouls. Score is distance survived, and it gets faster the longer you last.",
  "icon": "storage/RADRUNNER.PNG",
  "previews": [
    "previews/START.BMP",
    "previews/GAME.BMP",
    "previews/GAME-SECOND.BMP"
  ],
  "type": "game",
  "readme": "README.md",
  "storage": [
    {
      "pipboy": "HOLO/RADRUNNER/APP.JS",
      "source": "storage/APP.TS"
    }
  ],
  "storageOptional": []
}
