{
  "id": "flappy",
  "name": "Flappy Roach",
  "author": "@JLDenson",
  "version": "1.0.1",
  "description": "A Fallout-themed take on the classic Flappy Bird. Guide a Radroach through the Wasteland, dodging every obstacle in its path.",
  "icon": "storage/FLAPPYROACH.PNG",
  "previews": ["previews/MENU.BMP", "previews/GAME.BMP"],
  "type": "game",
  "readme": "README.md",
  "storage": [
    {
      "pipboy": "HOLO/FLAPPY/APP.JS",
      "source": "storage/APP.TS"
    },
    {
      "pipboy": "HOLO/FLAPPY/BEETLEFLYING.WAV",
      "source": "storage/BEETLEFLYING.WAV"
    },
    {
      "pipboy": "HOLO/FLAPPY/GAMEOVER.WAV",
      "source": "storage/GAMEOVER.WAV"
    },
    {
      "pipboy": "HOLO/FLAPPY/HITGROUND.WAV",
      "source": "storage/HITGROUND.WAV"
    },
    {
      "pipboy": "HOLO/FLAPPY/SPLATONPIPE.WAV",
      "source": "storage/SPLATONPIPE.WAV"
    },
    {
      "pipboy": "HOLO/FLAPPY/STARTGAME.WAV",
      "source": "storage/STARTGAME.WAV"
    }
  ],
  "storageOptional": []
}
