{
  "id": "bloodworm",
  "name": "Bloodworm",
  "author": "@CodyTolene",
  "version": "2.0.0",
  "description": "Scavenge mutfruit, grow longer, and keep your bloodworm alive by avoiding walls, your own tail, and your opponent (vs mode).",
  "icon": "storage/BLOODWORM.PNG",
  "previews": [
    "previews/BLOODWORM.MP4",
    "previews/MENU.BMP",
    "previews/ONE-PLAYER.BMP",
    "previews/TWO-PLAYER.BMP"
  ],
  "type": "game",
  "readme": "README.md",
  "storage": [
    {
      "pipboy": "HOLO/BLOODWORM/APP.JS",
      "source": "storage/APP.TS"
    },
    {
      "pipboy": "HOLO/BLOODWORM/BLOODWORM.JSON",
      "source": "storage/BLOODWORM.JSON"
    }
  ],
  "storageOptional": [
    {
      "label": "Eat (Sound Effect)",
      "previewMp3": "previews/BLOODWORM-EAT.MP3",
      "sizeKB": 10,
      "pipboy": "HOLO/BLOODWORM/BLOODWORM-EAT.WAV",
      "source": "optional/BLOODWORM-EAT.WAV"
    },
    {
      "label": "Die (Sound Effect)",
      "previewMp3": "previews/BLOODWORM-DIE.MP3",
      "sizeKB": 12,
      "pipboy": "HOLO/BLOODWORM/BLOODWORM-DIE.WAV",
      "source": "optional/BLOODWORM-DIE.WAV"
    },
    {
      "label": "Start (Sound Effect)",
      "previewMp3": "previews/BLOODWORM-START.MP3",
      "sizeKB": 19,
      "pipboy": "HOLO/BLOODWORM/BLOODWORM-START.WAV",
      "source": "optional/BLOODWORM-START.WAV"
    }
  ]
}
