{
  "id": "killteamtracker",
  "name": "Kill Team Tracker",
  "author": "@SethSanchez",
  "version": "1.0.0",
  "description": "A Pip-powered counter for 40k Kill Team. Will track your VP, CP, and the TP.",
  "icon": "storage/KILLTEAM.PNG",
  "previews": ["previews/MENU.BMP", "previews/START.BMP"],
  "tags": "game,tool",
  "type": "game",
  "readme": "README.md",
  "storage": [
    {
      "pipboy": "HOLO/KILLTEAM/APP.JS",
      "source": "storage/APP.TS"
    }
  ]
}
