{
  "id": "magic8ballplus",
  "previousId": "magic8ball",
  "name": "Magic 8 Ball+",
  "author": "@Theeohn @joemto20-tech",
  "version": "1.1.1",
  "description": "A classic and an updated Magic 8 Ball, all 20 original and plenty new responses. Plus a few rare resonses if you keep asking! Shake your pipboy or spin/press a wheel to get a new answer!",
  "icon": "storage/MAGIC8BALLPLUS.IMG",
  "previews": [
    "previews/MENU.BMP",
    "previews/CLASSIC.BMP",
    "previews/PLUS.BMP"
  ],
  "type": "game",
  "readme": "README.md",
  "storage": [
    {
      "pipboy": "HOLO/MAGIC_8_BALL_PLUS/APP.JS",
      "source": "storage/APP.TS"
    },
    {
      "pipboy": "HOLO/MAGIC_8_BALL_PLUS/TITLE.BIN",
      "source": "storage/TITLE.BIN"
    }
  ],
  "storageOptional": []
}
