{
  "id": "pipvideocontroller",
  "name": "PipVideoController",
  "author": "@OrionMissesRust",
  "version": "1.0.0",
  "description": "Play videos using your pip-boy on your pc.",
  "icon": "storage/PIPVIDEOCONTROLLER.PNG",
  "previews": ["previews/START.BMP"],
  "type": "app",
  "readme": "README.md",
  "storage": [
    {
      "pipboy": "HOLO/PIPVIDEOCONTROLLER/APP.JS",
      "source": "storage/APP.TS"
    }
  ],
  "storageOptional": []
}
