{
  "id": "pipcalendar",
  "name": "Pip-Calendar",
  "author": "@GlitchedMicrowave",
  "version": "1.0.1",
  "description": "A simple calendar and note-taking app for you Pip-Boy.",
  "icon": "storage/ICON.PNG",
  "previews": ["previews/CALENDARPREVIEW.BMP"],
  "type": "app",
  "readme": "README.md",
  "storage": [
    {
      "pipboy": "HOLO/PIPCALENDAR/APP.JS",
      "source": "storage/APP.TS"
    },
    {
      "pipboy": "HOLO/PIPCALENDAR/DAYS.IMG",
      "source": "storage/DAYS.IMG"
    },
    {
      "pipboy": "HOLO/PIPCALENDAR/ROBCO.IMG",
      "source": "storage/ROBCO.IMG"
    }
  ],
  "storageOptional": []
}
