{
  "id": "hamcocalendar",
  "name": "HAMCo Calendar",
  "author": "@joemto20-tech",
  "version": "1.0.0",
  "description": "A native-feeling calendar with date jumping and note-taking.",
  "icon": "storage/HAMCAL.IMG",
  "previews": ["previews/AUG.BMP"],
  "type": "app",
  "readme": "README.md",
  "storage": [
    {
      "pipboy": "HOLO/CALENDAR/APP.JS",
      "source": "storage/APP.TS"
    },
    {
      "pipboy": "HOLO/CALENDAR/JAN.IMG",
      "source": "storage/JAN.IMG"
    },
    {
      "pipboy": "HOLO/CALENDAR/FEB.IMG",
      "source": "storage/FEB.IMG"
    },
    {
      "pipboy": "HOLO/CALENDAR/MAR.IMG",
      "source": "storage/MAR.IMG"
    },
    {
      "pipboy": "HOLO/CALENDAR/APRIL.IMG",
      "source": "storage/APRIL.IMG"
    },
    {
      "pipboy": "HOLO/CALENDAR/MAY.IMG",
      "source": "storage/MAY.IMG"
    },
    {
      "pipboy": "HOLO/CALENDAR/JUNE.IMG",
      "source": "storage/JUNE.IMG"
    },
    {
      "pipboy": "HOLO/CALENDAR/JULY.IMG",
      "source": "storage/JULY.IMG"
    },
    {
      "pipboy": "HOLO/CALENDAR/AUG.IMG",
      "source": "storage/AUG.IMG"
    },
    {
      "pipboy": "HOLO/CALENDAR/SEP.IMG",
      "source": "storage/SEP.IMG"
    },
    {
      "pipboy": "HOLO/CALENDAR/OCT.IMG",
      "source": "storage/OCT.IMG"
    },
    {
      "pipboy": "HOLO/CALENDAR/NOV.IMG",
      "source": "storage/NOV.IMG"
    },
    {
      "pipboy": "HOLO/CALENDAR/DEC.IMG",
      "source": "storage/DEC.IMG"
    }
  ],
  "storageOptional": []
}
