{
  "id": "zero-escape-vault-9",
  "name": "Zero Escape Vault 9",
  "author": "@Johnnyjoestar987",
  "version": "1.0.0",
  "description": "A Nonary-style ALLY/BETRAY voting game where you and seven CPU rivals bargain, betray and race to escape Vault 9.",
  "icon": "storage/ZERO_ESCAPE_VAULT_9.IMG",
  "previews": [
    "previews/MENU.PNG",
    "previews/VAULT.PNG",
    "previews/RESULTS.PNG",
    "previews/GAMEOVER.PNG"
  ],
  "type": "game",
  "readme": "README.md",
  "storage": [
    {
      "pipboy": "HOLO/ZERO_ESCAPE_VAULT_9/APP.JS",
      "source": "storage/APP.TS"
    },
    {
      "pipboy": "HOLO/ZERO_ESCAPE_VAULT_9/DATA.JSON",
      "source": "storage/DATA.JSON"
    }
  ],
  "storageOptional": [
    {
      "label": "Intro Image",
      "sizeKB": 38,
      "pipboy": "HOLO/ZERO_ESCAPE_VAULT_9/MAINSCREEN.BIN",
      "source": "optional/MAINSCREEN.BIN"
    },
    {
      "label": "Door Opens Image",
      "sizeKB": 38,
      "pipboy": "HOLO/ZERO_ESCAPE_VAULT_9/DOOROPENS.BIN",
      "source": "optional/DOOROPENS.BIN"
    },
    {
      "label": "Main Theme Music",
      "previewMp3": "previews/MAINTHEME.MP3",
      "sizeKB": 1367,
      "pipboy": "HOLO/ZERO_ESCAPE_VAULT_9/MAINTHEME.WAV",
      "source": "optional/MAINTHEME.WAV"
    },
    {
      "label": "Background Music",
      "previewMp3": "previews/BACKGROUND.MP3",
      "sizeKB": 1099,
      "pipboy": "HOLO/ZERO_ESCAPE_VAULT_9/BACKGROUND.WAV",
      "source": "optional/BACKGROUND.WAV"
    },
    {
      "label": "CRT On SFX",
      "previewMp3": "previews/CRT_ON.MP3",
      "sizeKB": 28,
      "pipboy": "HOLO/ZERO_ESCAPE_VAULT_9/CRT_ON.WAV",
      "source": "optional/CRT_ON.WAV"
    }
  ]
}
