{
  "id": "brkbnce",
  "name": "Brick Bounce",
  "author": "@HtheB",
  "version": "1.0.0",
  "description": "An original arcade brick-breaker with 50 levels, power-ups, profiles, custom levels, and unlockable bonus games.",
  "icon": "storage/BRKBNCE.IMG",
  "previews": [
    "previews/PREVIEW.PNG",
    "previews/GAMEPLAY.PNG",
    "previews/INITIALS.PNG"
  ],
  "type": "game",
  "readme": "README.md",
  "storage": [
    {
      "pipboy": "HOLO/BRKBNCE/APP.JS",
      "source": "storage/APP.TS"
    },
    {
      "pipboy": "HOLO/BRKBNCE/MAIN.JS",
      "source": "storage/MAIN.TS"
    },
    {
      "pipboy": "HOLO/BRKBNCE/SAVE.JS",
      "source": "storage/SAVE.TS"
    },
    {
      "pipboy": "HOLO/BRKBNCE/SAVEW.JS",
      "source": "storage/SAVEW.TS"
    },
    {
      "pipboy": "HOLO/BRKBNCE/START.JS",
      "source": "storage/START.TS"
    },
    {
      "pipboy": "HOLO/BRKBNCE/GAME.JS",
      "source": "storage/GAME.TS"
    },
    {
      "pipboy": "HOLO/BRKBNCE/DEMO.JS",
      "source": "storage/DEMO.TS"
    },
    {
      "pipboy": "HOLO/BRKBNCE/PONG.JS",
      "source": "storage/PONG.TS"
    },
    {
      "pipboy": "HOLO/BRKBNCE/SNAKE.JS",
      "source": "storage/SNAKE.TS"
    },
    {
      "pipboy": "HOLO/BRKBNCE/FLOATY.JS",
      "source": "storage/FLOATY.TS"
    },
    {
      "pipboy": "HOLO/BRKBNCE/RUN.JS",
      "source": "storage/RUN.TS"
    },
    {
      "pipboy": "HOLO/BRKBNCE/MUSIC.JS",
      "source": "storage/MUSIC.TS"
    },
    {
      "pipboy": "HOLO/BRKBNCE/CUSTOM.JS",
      "source": "storage/CUSTOM.TS"
    },
    {
      "pipboy": "HOLO/BRKBNCE/VICT.JS",
      "source": "storage/VICT.TS"
    },
    {
      "pipboy": "HOLO/BRKBNCE/HELP.JS",
      "source": "storage/HELP.TS"
    },
    {
      "pipboy": "HOLO/BRKBNCE/NAME.JS",
      "source": "storage/NAME.TS"
    },
    {
      "pipboy": "HOLO/BRKBNCE/UPLOAD.JS",
      "source": "storage/UPLOAD.TS"
    },
    {
      "pipboy": "HOLO/BRKBNCE/SCORE.JS",
      "source": "storage/SCORE.TS"
    },
    {
      "pipboy": "HOLO/BRKBNCE/BRICKS.JS",
      "source": "storage/BRICKS.TS"
    },
    {
      "pipboy": "HOLO/BRKBNCE/LEVELS.TXT",
      "source": "storage/LEVELS.TXT"
    },
    {
      "pipboy": "HOLO/BRKBNCE/UI1.BIN",
      "source": "storage/UI1.BIN"
    },
    {
      "pipboy": "HOLO/BRKBNCE/UI2.BIN",
      "source": "storage/UI2.BIN"
    },
    {
      "pipboy": "HOLO/BRKBNCE/UI3.BIN",
      "source": "storage/UI3.BIN"
    },
    {
      "pipboy": "HOLO/BRKBNCE/ONLINE.IMG",
      "source": "storage/ONLINE.IMG"
    },
    {
      "pipboy": "HOLO/BRKBNCE/ABOUT.AVI",
      "source": "storage/ABOUT.AVI"
    },
    {
      "pipboy": "HOLO/BRKBNCE/ABOUTC.AVI",
      "source": "storage/ABOUTC.AVI"
    },
    {
      "pipboy": "HOLO/BRKBNCE/INTRO.WAV",
      "source": "storage/INTRO.WAV"
    },
    {
      "pipboy": "HOLO/BRKBNCE/MUS1.WAV",
      "source": "storage/MUS1.WAV"
    },
    {
      "pipboy": "HOLO/BRKBNCE/MUS2.WAV",
      "source": "storage/MUS2.WAV"
    },
    {
      "pipboy": "HOLO/BRKBNCE/MUS3.WAV",
      "source": "storage/MUS3.WAV"
    },
    {
      "pipboy": "HOLO/BRKBNCE/MUS4.WAV",
      "source": "storage/MUS4.WAV"
    },
    {
      "pipboy": "HOLO/BRKBNCE/OVER.WAV",
      "source": "storage/OVER.WAV"
    },
    {
      "pipboy": "HOLO/BRKBNCE/SERVE.WAV",
      "source": "storage/SERVE.WAV"
    },
    {
      "pipboy": "HOLO/BRKBNCE/PAD.WAV",
      "source": "storage/PAD.WAV"
    },
    {
      "pipboy": "HOLO/BRKBNCE/WALL.WAV",
      "source": "storage/WALL.WAV"
    },
    {
      "pipboy": "HOLO/BRKBNCE/HIT.WAV",
      "source": "storage/HIT.WAV"
    },
    {
      "pipboy": "HOLO/BRKBNCE/BRK.WAV",
      "source": "storage/BRK.WAV"
    },
    {
      "pipboy": "HOLO/BRKBNCE/CLANK.WAV",
      "source": "storage/CLANK.WAV"
    },
    {
      "pipboy": "HOLO/BRKBNCE/LOSE.WAV",
      "source": "storage/LOSE.WAV"
    },
    {
      "pipboy": "HOLO/BRKBNCE/CLEAR.WAV",
      "source": "storage/CLEAR.WAV"
    },
    {
      "pipboy": "HOLO/BRKBNCE/GAME.WAV",
      "source": "storage/GAME.WAV"
    },
    {
      "pipboy": "HOLO/BRKBNCE/POWER.WAV",
      "source": "storage/POWER.WAV"
    },
    {
      "pipboy": "HOLO/BRKBNCE/BAD.WAV",
      "source": "storage/BAD.WAV"
    },
    {
      "pipboy": "HOLO/BRKBNCE/LIFE.WAV",
      "source": "storage/LIFE.WAV"
    }
  ],
  "storageOptional": []
}
