{
  "id": "pipchess",
  "name": "PipChess",
  "author": "@OrionMissesRust",
  "version": "1.0.0",
  "description": "Chess on the Pip-Boy!",
  "icon": "storage/PIPCHESS.PNG",
  "previews": ["previews/MENU.BMP", "previews/GAME.BMP"],
  "type": "game",
  "readme": "README.md",
  "storage": [
    {
      "pipboy": "HOLO/PIPCHESS/APP.JS",
      "source": "storage/APP.TS"
    }
  ],
  "storageOptional": []
}
