{
  "id": "sukechi",
  "name": "Sukechi",
  "author": "@Theeohn",
  "version": "1.1.0",
  "description": "Like an etch-a-sketch but for your pip-boy and shades to choose from, autosave, and an eraser!",
  "icon": "storage/SUKECHI.PNG",
  "previews": ["previews/GAME.BMP"],
  "previousId": "ssukechi",
  "type": "game",
  "readme": "README.md",
  "storage": [
    {
      "pipboy": "HOLO/SUKECHI/APP.JS",
      "source": "storage/APP.TS"
    }
  ],
  "storageOptional": []
}
