{
  "id": "signal-match",
  "name": "Signal Match",
  "author": "@Radiomaru7",
  "version": "1.0.0",
  "description": "Watch the sequence of numbered panels light up, then repeat it back.",
  "icon": "storage/SIGNAL-MATCH.IMG",
  "previews": ["previews/GAME01.BMP", "previews/GAME02.BMP"],
  "type": "game",
  "readme": "README.md",
  "storage": [
    {
      "pipboy": "HOLO/SIGNAL_MATCH/APP.JS",
      "source": "storage/APP.TS"
    }
  ],
  "storageOptional": []
}
