{
  "id": "piptris",
  "name": "Piptris",
  "author": "@CodyTolene",
  "version": "4.1.0",
  "description": "Stack, rotate, and clear falling blocks in this Tetris inspired mini-game. Simple, addictive, and perfect for idle moments between scavenging runs or stimpak breaks.",
  "icon": "storage/PIPTRIS.PNG",
  "previews": [
    "previews/INTRO.BMP",
    "previews/MENU.BMP",
    "previews/INSTRUCTIONS.BMP",
    "previews/GAME.BMP"
  ],
  "type": "game",
  "readme": "README.md",
  "storage": [
    {
      "pipboy": "HOLO/PIPTRIS/APP.JS",
      "source": "storage/APP.TS"
    },
    {
      "pipboy": "HOLO/PIPTRIS/BLOCK.JSON",
      "source": "storage/BLOCK.JSON"
    },
    {
      "pipboy": "HOLO/PIPTRIS/EXPL_01.WAV",
      "source": "storage/EXPL_01.WAV"
    },
    {
      "pipboy": "HOLO/PIPTRIS/EXPL_02.WAV",
      "source": "storage/EXPL_02.WAV"
    },
    {
      "pipboy": "HOLO/PIPTRIS/EXPL_03.WAV",
      "source": "storage/EXPL_03.WAV"
    },
    {
      "pipboy": "HOLO/PIPTRIS/EXPL_04.WAV",
      "source": "storage/EXPL_04.WAV"
    },
    {
      "pipboy": "HOLO/PIPTRIS/GAME.JS",
      "source": "storage/GAME.TS"
    },
    {
      "pipboy": "HOLO/PIPTRIS/GAME.RAW",
      "source": "storage/GAME.RAW"
    },
    {
      "pipboy": "HOLO/PIPTRIS/GAME_OVER.JS",
      "source": "storage/GAME_OVER.TS"
    },
    {
      "pipboy": "HOLO/PIPTRIS/INST.JS",
      "source": "storage/INST.TS"
    },
    {
      "pipboy": "HOLO/PIPTRIS/INTRO.JS",
      "source": "storage/INTRO.TS"
    },
    {
      "pipboy": "HOLO/PIPTRIS/INTRO.RAW",
      "source": "storage/INTRO.RAW"
    },
    {
      "pipboy": "HOLO/PIPTRIS/MENU.JS",
      "source": "storage/MENU.TS"
    },
    {
      "pipboy": "HOLO/PIPTRIS/MENU.RAW",
      "source": "storage/MENU.RAW"
    },
    {
      "pipboy": "HOLO/PIPTRIS/NUKE.JSON",
      "source": "storage/NUKE.JSON"
    },
    {
      "pipboy": "HOLO/PIPTRIS/PRELOAD.JS",
      "source": "storage/PRELOAD.TS"
    },
    {
      "pipboy": "HOLO/PIPTRIS/SETTINGS.JS",
      "source": "storage/SETTINGS.TS"
    }
  ],
  "storageOptional": [
    {
      "label": "Electro Swing (Music)",
      "previewMp3": "previews/PIPTRIS-ELECTRO-SWING.MP3",
      "sizeKB": 1150,
      "pipboy": "PIPTRIS/PIPTRIS-ELECTRO-SWING.WAV",
      "source": "optional/PIPTRIS-ELECTRO-SWING.WAV"
    },
    {
      "label": "Symphony (Music)",
      "previewMp3": "previews/PIPTRIS-SYMPHONY.MP3",
      "sizeKB": 1614,
      "pipboy": "PIPTRIS/PIPTRIS-SYMPHONY.WAV",
      "source": "optional/PIPTRIS-SYMPHONY.WAV"
    },
    {
      "label": "Whimsical (Music)",
      "previewMp3": "previews/PIPTRIS-WHIMSICAL.MP3",
      "sizeKB": 1635,
      "pipboy": "PIPTRIS/PIPTRIS-WHIMSICAL.WAV",
      "source": "optional/PIPTRIS-WHIMSICAL.WAV"
    }
  ]
}
