{
  "id": "hamcolock",
  "name": "HAMCo Lock",
  "author": "@joemto20-tech",
  "version": "1.0.0",
  "description": "A PIN lock screen for your Pip-Boy. Set a 4-digit access code, pick a faction logo, and choose whether it locks on startup, on wake from sleep, or both.",
  "icon": "storage/HAMCOLOCK.IMG",
  "previews": ["previews/SETTINGS.BMP"],
  "tags": "system,tool",
  "type": "app",
  "readme": "README.md",
  "storage": [
    {
      "pipboy": "APPINFO/HAMCOLOCK.INFO",
      "source": "storage/HAMCOLOCK.INFO"
    },
    {
      "pipboy": "HOLO/HAMCOLOCK/APP.JS",
      "source": "storage/APP.TS"
    },
    {
      "pipboy": "HOLO/HAMCOLOCK/SERVICE.JS",
      "source": "storage/SERVICE.TS"
    },
    {
      "pipboy": "HOLO/HAMCOLOCK/LOCK.JS",
      "source": "storage/LOCK.TS"
    },
    {
      "pipboy": "HOLO/HAMCOLOCK/GRANT.JS",
      "source": "storage/GRANT.TS"
    },
    {
      "pipboy": "HOLO/HAMCOLOCK/SETTINGS.JS",
      "source": "storage/SETTINGS.TS"
    },
    {
      "pipboy": "HOLO/HAMCOLOCK/SETPIN.JS",
      "source": "storage/SETPIN.TS"
    },
    {
      "pipboy": "HOLO/HAMCOLOCK/HAMCOLOCK.IMG",
      "source": "storage/HAMCOLOCK.IMG"
    },
    {
      "pipboy": "HOLO/HAMCOLOCK/A.WAV",
      "source": "storage/A.WAV"
    },
    {
      "pipboy": "HOLO/HAMCOLOCK/G.AVI",
      "source": "storage/G.AVI"
    },
    {
      "pipboy": "HOLO/HAMCOLOCK/ATOMCATS.BIN",
      "source": "storage/ATOMCATS.BIN"
    },
    {
      "pipboy": "HOLO/HAMCOLOCK/BIGMT.BIN",
      "source": "storage/BIGMT.BIN"
    },
    {
      "pipboy": "HOLO/HAMCOLOCK/BROTHERHOOD.BIN",
      "source": "storage/BROTHERHOOD.BIN"
    },
    {
      "pipboy": "HOLO/HAMCOLOCK/ENCLAVE.BIN",
      "source": "storage/ENCLAVE.BIN"
    },
    {
      "pipboy": "HOLO/HAMCOLOCK/ENCLAVE1.BIN",
      "source": "storage/ENCLAVE1.BIN"
    },
    {
      "pipboy": "HOLO/HAMCOLOCK/FIENDS.BIN",
      "source": "storage/FIENDS.BIN"
    },
    {
      "pipboy": "HOLO/HAMCOLOCK/FOLLOWERS.BIN",
      "source": "storage/FOLLOWERS.BIN"
    },
    {
      "pipboy": "HOLO/HAMCOLOCK/GREATKHANS.BIN",
      "source": "storage/GREATKHANS.BIN"
    },
    {
      "pipboy": "HOLO/HAMCOLOCK/GUNNERS.BIN",
      "source": "storage/GUNNERS.BIN"
    },
    {
      "pipboy": "HOLO/HAMCOLOCK/HAM.BIN",
      "source": "storage/HAM.BIN"
    },
    {
      "pipboy": "HOLO/HAMCOLOCK/INTERSTATE80.BIN",
      "source": "storage/INTERSTATE80.BIN"
    },
    {
      "pipboy": "HOLO/HAMCOLOCK/KINGS.BIN",
      "source": "storage/KINGS.BIN"
    },
    {
      "pipboy": "HOLO/HAMCOLOCK/LEGION.BIN",
      "source": "storage/LEGION.BIN"
    },
    {
      "pipboy": "HOLO/HAMCOLOCK/MOTHMAN.BIN",
      "source": "storage/MOTHMAN.BIN"
    },
    {
      "pipboy": "HOLO/HAMCOLOCK/NCR.BIN",
      "source": "storage/NCR.BIN"
    },
    {
      "pipboy": "HOLO/HAMCOLOCK/NCRSEAL.BIN",
      "source": "storage/NCRSEAL.BIN"
    },
    {
      "pipboy": "HOLO/HAMCOLOCK/OPERATORS.BIN",
      "source": "storage/OPERATORS.BIN"
    },
    {
      "pipboy": "HOLO/HAMCOLOCK/RANGERS.BIN",
      "source": "storage/RANGERS.BIN"
    },
    {
      "pipboy": "HOLO/HAMCOLOCK/REDTALON.BIN",
      "source": "storage/REDTALON.BIN"
    },
    {
      "pipboy": "HOLO/HAMCOLOCK/RESPONDERS.BIN",
      "source": "storage/RESPONDERS.BIN"
    },
    {
      "pipboy": "HOLO/HAMCOLOCK/SMUGGLERS.BIN",
      "source": "storage/SMUGGLERS.BIN"
    },
    {
      "pipboy": "HOLO/HAMCOLOCK/TUNNELSNAKES.BIN",
      "source": "storage/TUNNELSNAKES.BIN"
    },
    {
      "pipboy": "HOLO/HAMCOLOCK/VANGRAFFS.BIN",
      "source": "storage/VANGRAFFS.BIN"
    },
    {
      "pipboy": "HOLO/HAMCOLOCK/VAULTTEC.BIN",
      "source": "storage/VAULTTEC.BIN"
    },
    {
      "pipboy": "HOLO/HAMCOLOCK/VIPERS.BIN",
      "source": "storage/VIPERS.BIN"
    },
    {
      "pipboy": "HOLO/HAMCOLOCK/WHITEGLOVE.BIN",
      "source": "storage/WHITEGLOVE.BIN"
    }
  ],
  "storageOptional": []
}
