{
  "id": "access-terminal",
  "name": "Access Terminal",
  "author": "@CodyTolene @pip-4111 @beaverboy-12",
  "version": "2.1.0",
  "description": "Crack locked RobCo terminals by guessing the correct password from a list of corrupted pre-war entries.",
  "icon": "storage/ACCESS-TERMINAL.PNG",
  "previews": ["previews/MENU.BMP", "previews/GAME.BMP"],
  "type": "game",
  "readme": "README.md",
  "storage": [
    {
      "pipboy": "HOLO/ACCESS/APP.JS",
      "source": "storage/APP.TS"
    },
    {
      "pipboy": "HOLO/ACCESS/WORDS_5.JSON",
      "source": "storage/WORDS_5.JSON"
    },
    {
      "pipboy": "HOLO/ACCESS/WORDS_6.JSON",
      "source": "storage/WORDS_6.JSON"
    },
    {
      "pipboy": "HOLO/ACCESS/WORDS_7.JSON",
      "source": "storage/WORDS_7.JSON"
    },
    {
      "pipboy": "HOLO/ACCESS/WORDS_8.JSON",
      "source": "storage/WORDS_8.JSON"
    },
    {
      "pipboy": "HOLO/ACCESS/WORDS_9.JSON",
      "source": "storage/WORDS_9.JSON"
    }
  ],
  "storageOptional": []
}
