{
  "id": "goattest",
  "name": "G.O.A.T.",
  "author": "@Theeohn",
  "version": "1.0.0",
  "description": "A text-based recreation of the Vault 101 Generalized Occupational Aptitude Test (G.O.A.T.) from Fallout 3. This holotape recreates all 10 original test questions and answers. Your answers are tallied by skill, and at the end of the test you're assigned a Vault job.",
  "icon": "storage/GOAT.PNG",
  "previews": ["previews/MENU.BMP", "previews/GAME.BMP"],
  "type": "game",
  "readme": "README.md",
  "storage": [
    {
      "pipboy": "HOLO/THEGOAT/APP.JS",
      "source": "storage/APP.TS"
    }
  ],
  "storageOptional": []
}
