{
  "id": "checkers",
  "name": "Checkers",
  "author": "@trekker87 @CodyTolene",
  "version": "1.1.0",
  "description": "A two-player Checkers game for the Pip-Boy 3000, with you playing against an AI opponent. Standard rules apply including forced jumps, multi-jumps, and king promotion.",
  "icon": "storage/CHECKERS.PNG",
  "previews": ["previews/MENU.BMP", "previews/GAME.BMP"],
  "type": "game",
  "readme": "README.md",
  "storage": [
    {
      "pipboy": "HOLO/CHECKERS/APP.JS",
      "source": "storage/APP.TS"
    },
    {
      "pipboy": "HOLO/CHECKERS/GAME.JS",
      "source": "storage/GAME.TS"
    },
    {
      "pipboy": "HOLO/CHECKERS/HELP.JS",
      "source": "storage/HELP.TS"
    },
    {
      "pipboy": "HOLO/CHECKERS/MENU.JS",
      "source": "storage/MENU.TS"
    }
  ],
  "storageOptional": []
}
